<?xml version="1.0" encoding="UTF-8" standalone="no"?>
<!-- edited with XMLSpy v2011 (x64) (http://www.altova.com) by cihi (CANADIAN INSTITUTE FOR HEALTH) -->
<!--W3C Schema generated by XMLSpy v2012 rel. 2 sp1 (x64) (http://www.altova.com)-->
<!--Please add namespace attributes, a targetNamespace attribute and import elements according to your requirements-->
<xs:schema xmlns:xs="http://www.w3.org/2001/XMLSchema" elementFormDefault="qualified">
	<xs:import namespace="http://www.w3.org/XML/1998/namespace"/>
	<xs:element name="workbook">
		<xs:complexType>
			<xs:sequence>
				<xs:element ref="worksheet" maxOccurs="unbounded"/>
			</xs:sequence>
		</xs:complexType>
	</xs:element>
	<xs:element name="worksheet">
		<xs:complexType>
			<xs:sequence>
				<xs:element ref="header" minOccurs="0" maxOccurs="unbounded"/>
				<xs:element ref="detailHeader" minOccurs="0" maxOccurs="unbounded"/>
				<xs:element ref="detail" minOccurs="0" maxOccurs="unbounded"/>
			</xs:sequence>
			<xs:attribute name="name" type="xs:string" use="required"/>
		</xs:complexType>
	</xs:element>
	<xs:element name="header">
		<xs:complexType>
			<xs:sequence>
				<xs:element ref="parameter" maxOccurs="unbounded"/>
			</xs:sequence>
		</xs:complexType>
	</xs:element>
	<xs:element name="detail">
		<xs:complexType>
			<xs:sequence>
				<xs:element ref="parameter" maxOccurs="unbounded"/>
			</xs:sequence>
			<xs:attribute name="startRowNumber" type="xs:integer" use="required"/>
			<xs:attribute name="name" type="xs:string" use="required"/>
		</xs:complexType>
	</xs:element>
	<xs:element name="parameter">
		<xs:complexType>
			<xs:sequence>
				<xs:element name="paraName" type="xs:string"/>
				<xs:element name="column_number" type="xs:integer"/>
				<xs:element name="row_number" type="xs:integer" minOccurs="0" maxOccurs="1"/>
				<xs:element name="paraType" type="xs:string" minOccurs="0"/>
			</xs:sequence>
		</xs:complexType>
	</xs:element>
	<xs:element name="detailHeader">
		<xs:complexType>
			<xs:sequence>
				<xs:element ref="parameter" maxOccurs="unbounded"/>
			</xs:sequence>
			<xs:attribute name="name">
				<xs:simpleType>
					<xs:restriction base="xs:string">
						<xs:minLength value="1"/>
					</xs:restriction>
				</xs:simpleType>
			</xs:attribute>
		</xs:complexType>
	</xs:element>
</xs:schema>
