<?xml version="1.0" encoding="UTF-8"?>
<workbook xmlns:xsi="http://www.w3.org/2001/XMLSchema-instance" xsi:noNamespaceSchemaLocation="cims_report.xsd">
	<worksheet name="CIMS Report">
		<header>
			<parameter>
				<paraName>classification</paraName>
				<column_number>3</column_number>
				<!-- C -->
				<row_number>4</row_number>
			</parameter>
			<parameter>
				<paraName>owner</paraName>
				<column_number>5</column_number>
				<!-- E -->
				<row_number>4</row_number>
			</parameter>
			<parameter>
				<paraName>fromStatus</paraName>
				<column_number>8</column_number>
				<!-- H -->
				<row_number>4</row_number>
			</parameter>
			<parameter>
				<paraName>year</paraName>
				<column_number>3</column_number>
				<!-- C -->
				<row_number>5</row_number>
			</parameter>
			<parameter>
				<paraName>fromDate</paraName>
				<column_number>5</column_number>
				<!-- E -->
				<row_number>5</row_number>
			</parameter>
			<parameter>
				<paraName>qaErrorCount</paraName>
				<column_number>8</column_number>
				<!-- H -->
				<row_number>5</row_number>
			</parameter>
			<parameter>
				<paraName>language</paraName>
				<column_number>3</column_number>
				<!-- C -->
				<row_number>6</row_number>
			</parameter>
			<parameter>
				<paraName>toDate</paraName>
				<column_number>5</column_number>
				<!-- E -->
				<row_number>6</row_number>
			</parameter>
		</header>
		<detail startRowNumber="9" name="detail1">
			<parameter>
				<paraName>changeRequestId</paraName>
				<column_number>2</column_number>
				<!-- B -->
			</parameter>
			<parameter>
				<paraName>date</paraName>
				<column_number>3</column_number>
				<!-- C -->
			</parameter>
			<parameter>
				<paraName>classification</paraName>
				<column_number>4</column_number>
				<!-- D -->
			</parameter>
			<parameter>
				<paraName>language</paraName>
				<column_number>5</column_number>
				<!-- E -->
			</parameter>
			<parameter>
				<paraName>owner</paraName>
				<column_number>6</column_number>
				<!-- F -->
			</parameter>
			<parameter>
				<paraName>fromStatus</paraName>
				<column_number>7</column_number>
				<!-- G -->
			</parameter>
			<parameter>
				<paraName>sendBackReason</paraName>
				<column_number>8</column_number>
				<!-- H -->
			</parameter>
		</detail>
	</worksheet>
</workbook>
