<?xml version="1.0" encoding="UTF-8"?>
<workbook xmlns:xsi="http://www.w3.org/2001/XMLSchema-instance" xsi:noNamespaceSchemaLocation="cims_report.xsd">
	<worksheet name="CIMS Report">
		<header>
			<parameter>
				<paraName>classification</paraName>
				<column_number>3</column_number>
				<!-- C -->
				<row_number>4</row_number>
			</parameter>
			<parameter>
				<paraName>dataHolding</paraName>
				<column_number>5</column_number>
				<!-- F -->
				<row_number>4</row_number>
			</parameter>
			<parameter>
				<paraName>year</paraName>
				<column_number>3</column_number>
				<!-- C -->
				<row_number>5</row_number>
			</parameter>
			<parameter>
				<paraName>codeFrom</paraName>
				<column_number>5</column_number>
				<!-- F -->
				<row_number>5</row_number>
			</parameter>
			<parameter>
				<paraName>codeTo</paraName>
				<column_number>5</column_number>
				<!-- F -->
				<row_number>6</row_number>
			</parameter>
		</header>
		<detail startRowNumber="10" name="detail1">
			<parameter>
				<paraName>codeValue</paraName>
				<column_number>2</column_number>
				<!-- B -->
			</parameter>
		</detail>
	</worksheet>
</workbook>
